{
  "SchemaVersion": 2,
  "Version": "1.0.0",
  "CatalogSha256": "03ecff4b1cc6899717c2a7552930baf98a535911e018fa33a021b5c59a73a018",
  "Resources": [
    {
      "StableId": "cute-bunny-cute-kawaii",
      "Version": "1.0.0",
      "Scope": "Online",
      "PackageSha256": "5b91eb342537bca782d99ed634fd40925155ad6d25f5d414e6392fbf74f810b7",
      "Author": "goat",
      "SourceUrl": "https://www.rw-designer.com/cursor-set/bunny-cute-kawaii",
      "License": "Release to Public Domain (RealWorld); inherited FROST resources: project MIT license",
      "LicenseEvidence": [
        {
          "Url": "https://github.com/catvir4493/cursorium-library/releases/download/library-v1.0.0/cute-bunny-cute-kawaii.zip",
          "Sha256": "f31257e63264320e9538319ae3947c1e3e16b76262c5e1e2919cfcaa13dae426",
          "Kind": "PackageNotice"
        },
        {
          "Url": "https://www.rw-designer.com/cursor-set/bunny-cute-kawaii",
          "Sha256": "7e9919fe3992896234de1c331066c839c4b74197c588095a583a57942c7e5b3e",
          "Kind": "SourcePage"
        }
      ],
      "CommercialClearance": "Needs Review",
      "RedistributionPermission": "Needs Review",
      "AttributionRequired": true,
      "ReviewStatus": "Needs Review",
      "MinimumClientVersion": "1.6.0",
      "DistributionChannel": [
        "Development",
        "Community"
      ],
      "WithdrawalStatus": "Active",
      "ReviewNote": "Needs commercial provenance review. Site license declaration and package NOTICE retained; no independent chain-of-title certification. Existing Community availability unchanged."
    },
    {
      "StableId": "cute-cool-cat",
      "Version": "1.0.0",
      "Scope": "Online",
      "PackageSha256": "f83777fbea02f46e90dc5c5f630b8130d1fa9d247cd3394a9bcfdb9d466cc5cb",
      "Author": "Bobcat",
      "SourceUrl": "https://www.rw-designer.com/cursor-set/cool-cat",
      "License": "Release to Public Domain (RealWorld); inherited FROST resources: project MIT license",
      "LicenseEvidence": [
        {
          "Url": "https://github.com/catvir4493/cursorium-library/releases/download/library-v1.0.0/cute-cool-cat.zip",
          "Sha256": "74e683861a8a29adecd820704dd4ec63e862c0e4c3eb7311dc1b51b971c14b1e",
          "Kind": "PackageNotice"
        },
        {
          "Url": "https://www.rw-designer.com/cursor-set/cool-cat",
          "Sha256": "7d3a09d2c1ba2ce06947534371f3a4476d6a4942309e69575dc0d7e5965633b9",
          "Kind": "SourcePage"
        }
      ],
      "CommercialClearance": "Needs Review",
      "RedistributionPermission": "Needs Review",
      "AttributionRequired": true,
      "ReviewStatus": "Needs Review",
      "MinimumClientVersion": "1.6.0",
      "DistributionChannel": [
        "Development",
        "Community"
      ],
      "WithdrawalStatus": "Active",
      "ReviewNote": "Needs commercial provenance review. Site license declaration and package NOTICE retained; no independent chain-of-title certification. Existing Community availability unchanged."
    },
    {
      "StableId": "cool-cat-superstar",
      "Version": "1.0.0",
      "Scope": "Online",
      "PackageSha256": "07facb74c2e8e35cac8309d8a3f64bf5f87fbf0fb05ccfb85b8ba67c2ea29795",
      "Author": "Bobcat",
      "SourceUrl": "https://www.rw-designer.com/cursor-set/cool-cat",
      "License": "Release to Public Domain (RealWorld); inherited FROST resources: project MIT license",
      "LicenseEvidence": [
        {
          "Url": "https://github.com/catvir4493/cursorium-library/releases/download/library-v1.0.0/cool-cat-superstar.zip",
          "Sha256": "10e55198badb5d37ca427acf91974fd2a6350dc86b3c24364947ff051ec16ea6",
          "Kind": "PackageNotice"
        },
        {
          "Url": "https://www.rw-designer.com/cursor-set/cool-cat",
          "Sha256": "7d3a09d2c1ba2ce06947534371f3a4476d6a4942309e69575dc0d7e5965633b9",
          "Kind": "SourcePage"
        }
      ],
      "CommercialClearance": "Needs Review",
      "RedistributionPermission": "Needs Review",
      "AttributionRequired": true,
      "ReviewStatus": "Needs Review",
      "MinimumClientVersion": "1.6.0",
      "DistributionChannel": [
        "Development",
        "Community"
      ],
      "WithdrawalStatus": "Active",
      "ReviewNote": "Needs commercial provenance review. Site license declaration and package NOTICE retained; no independent chain-of-title certification. Existing Community availability unchanged."
    },
    {
      "StableId": "cute-kawaii-cat-curs0rs",
      "Version": "1.0.0",
      "Scope": "Online",
      "PackageSha256": "c0afa04473f93e9f200b7c6b619eda59b1c129d1a795579d4524e86cd317ba28",
      "Author": "MUFFET!! (archive: Sun_l1ght)",
      "SourceUrl": "https://www.rw-designer.com/cursor-set/kawaii-cat-curs0rs",
      "License": "Release to Public Domain (RealWorld); inherited FROST resources: project MIT license",
      "LicenseEvidence": [
        {
          "Url": "https://github.com/catvir4493/cursorium-library/releases/download/library-v1.0.0/cute-kawaii-cat-curs0rs.zip",
          "Sha256": "b91ffa20af15fc7d1dd9efe24e0488b35be9b509a2734f2290ca9dad0fb806d7",
          "Kind": "PackageNotice"
        },
        {
          "Url": "https://www.rw-designer.com/cursor-set/kawaii-cat-curs0rs",
          "Sha256": "9b3a7c59381ff4bdbb9b06b3c56af534cfa1fe8d030e48ac262c665eded98b24",
          "Kind": "SourcePage"
        }
      ],
      "CommercialClearance": "Needs Review",
      "RedistributionPermission": "Needs Review",
      "AttributionRequired": true,
      "ReviewStatus": "Needs Review",
      "MinimumClientVersion": "1.6.0",
      "DistributionChannel": [
        "Development",
        "Community"
      ],
      "WithdrawalStatus": "Active",
      "ReviewNote": "Needs commercial provenance review. Site license declaration and package NOTICE retained; no independent chain-of-title certification. Existing Community availability unchanged. Author aliases/archive attribution require confirmation."
    },
    {
      "StableId": "cute-kawaii-pink-heart",
      "Version": "1.0.0",
      "Scope": "Online",
      "PackageSha256": "39d5ace0ea309e64472174b28bfb17574ed00d1cc3c6ea7279a0dec74912e76a",
      "Author": "bobalover (archive: yurilover)",
      "SourceUrl": "https://www.rw-designer.com/cursor-set/kawaii-pink-heart",
      "License": "Release to Public Domain (RealWorld); inherited FROST resources: project MIT license",
      "LicenseEvidence": [
        {
          "Url": "https://github.com/catvir4493/cursorium-library/releases/download/library-v1.0.0/cute-kawaii-pink-heart.zip",
          "Sha256": "0c19883f1c660e1df171ae4401694edadf2d91384d0ca659fe91c47669c01d35",
          "Kind": "PackageNotice"
        },
        {
          "Url": "https://www.rw-designer.com/cursor-set/kawaii-pink-heart",
          "Sha256": "29eb6d7648ae9315c252cb4df3dc04933ff105230eb909cd86afdb690eaef176",
          "Kind": "SourcePage"
        }
      ],
      "CommercialClearance": "Needs Review",
      "RedistributionPermission": "Needs Review",
      "AttributionRequired": true,
      "ReviewStatus": "Needs Review",
      "MinimumClientVersion": "1.6.0",
      "DistributionChannel": [
        "Development",
        "Community"
      ],
      "WithdrawalStatus": "Active",
      "ReviewNote": "Needs commercial provenance review. Site license declaration and package NOTICE retained; no independent chain-of-title certification. Existing Community availability unchanged. Author aliases/archive attribution require confirmation."
    },
    {
      "StableId": "cute-pastel",
      "Version": "1.0.0",
      "Scope": "Online",
      "PackageSha256": "11de2b0a2653c24ff1610161367294a227f57f4514b60559e26ddd3074d9e3bc",
      "Author": "saraantie · shapes: quackyduck",
      "SourceUrl": "https://www.rw-designer.com/cursor-set/pastel",
      "License": "Release to Public Domain (RealWorld); inherited FROST resources: project MIT license",
      "LicenseEvidence": [
        {
          "Url": "https://github.com/catvir4493/cursorium-library/releases/download/library-v1.0.0/cute-pastel.zip",
          "Sha256": "9c42d7eb85f91da57a96fed52125877ad9f09d06f17b98f9b1c916842461468f",
          "Kind": "PackageNotice"
        },
        {
          "Url": "https://www.rw-designer.com/cursor-set/pastel",
          "Sha256": "713885342da357c1ef1dd52d793c024a0a33b32075408f83222431038eb233e7",
          "Kind": "SourcePage"
        }
      ],
      "CommercialClearance": "Needs Review",
      "RedistributionPermission": "Needs Review",
      "AttributionRequired": true,
      "ReviewStatus": "Needs Review",
      "MinimumClientVersion": "1.6.0",
      "DistributionChannel": [
        "Development",
        "Community"
      ],
      "WithdrawalStatus": "Active",
      "ReviewNote": "Needs commercial provenance review. Site license declaration and package NOTICE retained; no independent chain-of-title certification. Existing Community availability unchanged. Source credits quackyduck shapes; derivative permission chain remains open."
    },
    {
      "StableId": "neon-blue",
      "Version": "1.0.0",
      "Scope": "Online",
      "PackageSha256": "35320c1274668f72f772af5d60fe973048042051713af9ed0afa67d623098bf2",
      "Author": "CURSORIUM",
      "SourceUrl": "https://github.com/catvir4493/cursorium",
      "License": "MIT",
      "LicenseEvidence": [
        {
          "Url": "https://github.com/catvir4493/cursorium-library/releases/download/library-v1.0.0/neon-blue.zip",
          "Sha256": "8b7d39b3d07052f635c08f9b07a769f4084763fb11579bdd517d0e89a26af1ac",
          "Kind": "PackageNotice"
        },
        {
          "Url": "https://github.com/catvir4493/cursorium/blob/7ed2719a7a842e201b3e2fb38a992bf711e8fd9d/LICENSE",